{
  "$schema": "https://vomaste.cz/schemas/canonical/relation.schema.json",
  "schemaVersion": 1,
  "@context": "https://vomaste.cz/context/v1.jsonld",
  "@id": "https://vomaste.cz/id/dossiers/igor-cerveny/relations/edge-lubor-novak-hemmont",
  "@type": "vomaste:Relation",
  "recordType": "relation",
  "identifier": "edge-lubor-novak-hemmont",
  "relationId": "edge-lubor-novak-hemmont",
  "dossier": {
    "@id": "https://vomaste.cz/id/dossiers/igor-cerveny"
  },
  "sourceEntity": {
    "@id": "https://vomaste.cz/id/entities/lubor-novak"
  },
  "targetEntity": {
    "@id": "https://vomaste.cz/id/entities/hemmont"
  },
  "relationType": "MEMBER_OF",
  "label": "člen představenstva společnosti Hemmont",
  "status": "corroborated",
  "claims": [
    {
      "@id": "https://vomaste.cz/id/dossiers/igor-cerveny/claims/CLM-30"
    }
  ],
  "sources": [
    {
      "@id": "https://vomaste.cz/id/dossiers/igor-cerveny/sources/SRC-25"
    },
    {
      "@id": "https://vomaste.cz/id/dossiers/igor-cerveny/sources/SRC-27"
    }
  ],
  "subjects": [],
  "directed": true,
  "order": 10,
  "content": [
    {
      "type": "markdown",
      "value": "Viz plné znění, kontext a sousední tvrzení v [hlavním přehledu](../../#graf-vztahu). Přidáno v rámci T-047 (provázání grafu, třetí dávka) z už existujícího, citovaného tvrzení tohoto dossieru."
    }
  ]
}
