{
  "$schema": "https://vomaste.cz/schemas/canonical/relation.schema.json",
  "schemaVersion": 1,
  "@context": "https://vomaste.cz/context/v1.jsonld",
  "@id": "https://vomaste.cz/id/dossiers/adam-vojtech/relations/edge-vojtech-synbiol",
  "@type": "vomaste:Relation",
  "recordType": "relation",
  "identifier": "edge-vojtech-synbiol",
  "relationId": "edge-vojtech-synbiol",
  "dossier": {
    "@id": "https://vomaste.cz/id/dossiers/adam-vojtech"
  },
  "sourceEntity": {
    "@id": "https://vomaste.cz/id/entities/vojtech"
  },
  "targetEntity": {
    "@id": "https://vomaste.cz/id/entities/synbiol"
  },
  "relationType": "ASSOCIATED_WITH_EVENT",
  "label": "komentář: holding SynBiol získal z veřejného zdravotního pojištění téměř 3 miliardy Kč",
  "status": "quote",
  "claims": [
    {
      "@id": "https://vomaste.cz/id/dossiers/adam-vojtech/claims/CLM-16"
    }
  ],
  "sources": [
    {
      "@id": "https://vomaste.cz/id/dossiers/adam-vojtech/sources/SRC-10"
    }
  ],
  "subjects": [],
  "directed": true,
  "order": 5,
  "content": [
    {
      "type": "markdown",
      "value": "Viz plné znění, kontext a sousední tvrzení v [hlavním přehledu](../../#graf-vztahu). Přidáno v rámci T-038 (provázání grafu) z už existujícího, citovaného tvrzení tohoto dossieru."
    }
  ]
}
