{
  "$schema": "https://vomaste.cz/schemas/canonical/relation.schema.json",
  "schemaVersion": 1,
  "@context": "https://vomaste.cz/context/v1.jsonld",
  "@id": "https://vomaste.cz/id/dossiers/jeronym-tejc/relations/edge-bitcoinova-kauza-krajsky-soud-brno",
  "@type": "vomaste:Relation",
  "recordType": "relation",
  "identifier": "edge-bitcoinova-kauza-krajsky-soud-brno",
  "relationId": "edge-bitcoinova-kauza-krajsky-soud-brno",
  "dossier": {
    "@id": "https://vomaste.cz/id/dossiers/jeronym-tejc"
  },
  "sourceEntity": {
    "@id": "https://vomaste.cz/id/entities/bitcoinova-kauza-ministerstva-spravedlnosti"
  },
  "targetEntity": {
    "@id": "https://vomaste.cz/id/entities/krajsky-soud-brno"
  },
  "relationType": "ASSOCIATED_WITH_EVENT",
  "label": "Bitcoinová kauza míří po obžalobě k projednání před Krajský soud v Brně",
  "status": "single",
  "claims": [
    {
      "@id": "https://vomaste.cz/id/dossiers/jeronym-tejc/claims/CLM-53"
    }
  ],
  "sources": [
    {
      "@id": "https://vomaste.cz/id/dossiers/jeronym-tejc/sources/SRC-30"
    }
  ],
  "subjects": [],
  "directed": true,
  "order": 21,
  "content": [
    {
      "type": "markdown",
      "value": "Viz plné znění, kontext a sousední tvrzení v [hlavním přehledu](../../#graf-vztahu). Hrana zachycuje procesní krok doložený už citovaným tvrzením tohoto dossieru; podání obžaloby není odsouzením."
    }
  ]
}
