{
  "$schema": "https://vomaste.cz/schemas/canonical/relation.schema.json",
  "schemaVersion": 1,
  "@context": "https://vomaste.cz/context/v1.jsonld",
  "@id": "https://vomaste.cz/id/dossiers/ivan-bednarik/relations/edge-bednarik-vaclav-nebesky",
  "@type": "vomaste:Relation",
  "recordType": "relation",
  "identifier": "edge-bednarik-vaclav-nebesky",
  "relationId": "edge-bednarik-vaclav-nebesky",
  "dossier": {
    "@id": "https://vomaste.cz/id/dossiers/ivan-bednarik"
  },
  "sourceEntity": {
    "@id": "https://vomaste.cz/id/entities/bednarik"
  },
  "targetEntity": {
    "@id": "https://vomaste.cz/id/entities/vaclav-nebesky"
  },
  "relationType": "ASSOCIATED_WITH_EVENT",
  "label": "současně s ním opustil představenstvo Českých drah (únor 2022)",
  "status": "corroborated",
  "claims": [
    {
      "@id": "https://vomaste.cz/id/dossiers/ivan-bednarik/claims/CLM-02"
    },
    {
      "@id": "https://vomaste.cz/id/dossiers/ivan-bednarik/claims/CLM-43"
    }
  ],
  "sources": [
    {
      "@id": "https://vomaste.cz/id/dossiers/ivan-bednarik/sources/SRC-02"
    },
    {
      "@id": "https://vomaste.cz/id/dossiers/ivan-bednarik/sources/SRC-29"
    },
    {
      "@id": "https://vomaste.cz/id/dossiers/ivan-bednarik/sources/SRC-19"
    },
    {
      "@id": "https://vomaste.cz/id/dossiers/ivan-bednarik/sources/SRC-20"
    }
  ],
  "subjects": [],
  "directed": true,
  "order": 5,
  "content": [
    {
      "type": "markdown",
      "value": "Viz plné znění, kontext a sousední tvrzení v [hlavním přehledu](../../#graf-vztahu). Přidáno v rámci T-047 (provázání grafu, třetí dávka) z už existujícího, citovaného tvrzení tohoto dossieru."
    }
  ]
}
