{
  "$schema": "https://vomaste.cz/schemas/canonical/relation.schema.json",
  "schemaVersion": 1,
  "@context": "https://vomaste.cz/context/v1.jsonld",
  "@id": "https://vomaste.cz/id/dossiers/ales-juchelka/relations/edge-babis-juchelka",
  "@type": "vomaste:Relation",
  "recordType": "relation",
  "identifier": "edge-babis-juchelka",
  "relationId": "edge-babis-juchelka",
  "dossier": {
    "@id": "https://vomaste.cz/id/dossiers/ales-juchelka"
  },
  "sourceEntity": {
    "@id": "https://vomaste.cz/id/entities/babis"
  },
  "targetEntity": {
    "@id": "https://vomaste.cz/id/entities/juchelka"
  },
  "relationType": "DEFENDED",
  "label": "premiér Babiš k případné škodě: „určitě pan ministr podá trestní oznámení“",
  "status": "single",
  "claims": [
    {
      "@id": "https://vomaste.cz/id/dossiers/ales-juchelka/claims/CLM-15"
    }
  ],
  "sources": [
    {
      "@id": "https://vomaste.cz/id/dossiers/ales-juchelka/sources/SRC-15"
    }
  ],
  "subjects": [],
  "directed": true,
  "order": 2,
  "content": [
    {
      "type": "markdown",
      "value": "Viz plné znění, kontext a sousední tvrzení v [hlavním přehledu](../../#graf-vztahu). Přidáno v rámci T-038 (provázání grafu) z už existujícího, citovaného tvrzení tohoto dossieru."
    }
  ]
}
