{
  "$schema": "https://vomaste.cz/schemas/canonical/relation.schema.json",
  "schemaVersion": 1,
  "@context": "https://vomaste.cz/context/v1.jsonld",
  "@id": "https://vomaste.cz/id/dossiers/karel-havlicek/relations/edge-havlicek-evropska-komise",
  "@type": "vomaste:Relation",
  "recordType": "relation",
  "identifier": "edge-havlicek-evropska-komise",
  "relationId": "edge-havlicek-evropska-komise",
  "dossier": {
    "@id": "https://vomaste.cz/id/dossiers/karel-havlicek"
  },
  "sourceEntity": {
    "@id": "https://vomaste.cz/id/entities/havlicek"
  },
  "targetEntity": {
    "@id": "https://vomaste.cz/id/entities/evropska-komise"
  },
  "relationType": "ASSOCIATED_WITH_EVENT",
  "label": "odmítnutí proplacení dotace na toustovou linku Agrofertu Evropskou komisí",
  "status": "single",
  "claims": [
    {
      "@id": "https://vomaste.cz/id/dossiers/karel-havlicek/claims/CLM-05"
    }
  ],
  "sources": [
    {
      "@id": "https://vomaste.cz/id/dossiers/karel-havlicek/sources/SRC-02"
    }
  ],
  "subjects": [],
  "directed": true,
  "order": 5,
  "content": [
    {
      "type": "markdown",
      "value": "Viz plné znění, kontext a sousední tvrzení v [hlavním přehledu](../../#graf-vztahu). Přidáno v rámci T-038 (provázání grafu) z už existujícího, citovaného tvrzení tohoto dossieru."
    }
  ]
}
