{
  "$schema": "https://vomaste.cz/schemas/canonical/relation.schema.json",
  "schemaVersion": 1,
  "@context": "https://vomaste.cz/context/v1.jsonld",
  "@id": "https://vomaste.cz/id/dossiers/zuzana-mrazova/relations/edge-mrazova-mestobilina",
  "@type": "vomaste:Relation",
  "recordType": "relation",
  "identifier": "edge-mrazova-mestobilina",
  "relationId": "edge-mrazova-mestobilina",
  "dossier": {
    "@id": "https://vomaste.cz/id/dossiers/zuzana-mrazova"
  },
  "sourceEntity": {
    "@id": "https://vomaste.cz/id/entities/mrazova"
  },
  "targetEntity": {
    "@id": "https://vomaste.cz/id/entities/mesto-bilina"
  },
  "relationType": "HOLDS_ROLE",
  "label": "před nástupem do vlády místostarostka a starostka Bíliny",
  "status": "corroborated",
  "claims": [
    {
      "@id": "https://vomaste.cz/id/dossiers/zuzana-mrazova/claims/CLM-34"
    }
  ],
  "sources": [
    {
      "@id": "https://vomaste.cz/id/dossiers/zuzana-mrazova/sources/SRC-21"
    },
    {
      "@id": "https://vomaste.cz/id/dossiers/zuzana-mrazova/sources/SRC-29"
    }
  ],
  "subjects": [],
  "directed": true,
  "order": 4,
  "content": [
    {
      "type": "markdown",
      "value": "Viz plné znění, kontext a sousední tvrzení v [hlavním přehledu](../../#graf-vztahu). Přidáno v rámci T-045 (provázání grafu, druhá dávka) z už existujícího, citovaného tvrzení tohoto dossieru."
    }
  ]
}
