{
  "$schema": "https://vomaste.cz/schemas/canonical/relation.schema.json",
  "schemaVersion": 1,
  "@context": "https://vomaste.cz/context/v1.jsonld",
  "@id": "https://vomaste.cz/id/dossiers/macinka-turek/relations/edge-macinka-motoriste",
  "@type": "vomaste:Relation",
  "recordType": "relation",
  "identifier": "edge-macinka-motoriste",
  "relationId": "edge-macinka-motoriste",
  "dossier": {
    "@id": "https://vomaste.cz/id/dossiers/macinka-turek"
  },
  "sourceEntity": {
    "@id": "https://vomaste.cz/id/entities/macinka"
  },
  "targetEntity": {
    "@id": "https://vomaste.cz/id/entities/motoriste"
  },
  "relationType": "HOLDS_ROLE",
  "label": "předseda",
  "status": "corroborated",
  "claims": [
    {
      "@id": "https://vomaste.cz/id/dossiers/macinka-turek/claims/CLM-03"
    }
  ],
  "sources": [
    {
      "@id": "https://vomaste.cz/id/dossiers/macinka-turek/sources/SRC-11"
    },
    {
      "@id": "https://vomaste.cz/id/dossiers/macinka-turek/sources/SRC-13"
    }
  ],
  "subjects": [
    "macinka"
  ],
  "directed": true,
  "order": 1,
  "content": [
    {
      "type": "markdown",
      "value": "Tato stránka je kanonický záznam vztahu edge-macinka-motoriste — typ vztahu, podporující tvrzení a zdroje v tabulce výše jsou úplné. Status FAKT znamená, že vztah je doložen nezávisle potvrzenými zdroji, ne jen tvrzením jedné strany. Hlavní stránka dossieru vykresluje interaktivní graf ze stejných dat."
    }
  ]
}
