{
  "$schema": "https://vomaste.cz/schemas/canonical/relation.schema.json",
  "schemaVersion": 1,
  "@context": "https://vomaste.cz/context/v1.jsonld",
  "@id": "https://vomaste.cz/id/dossiers/macinka-turek/relations/edge-klubmotoristu-motoriste",
  "@type": "vomaste:Relation",
  "recordType": "relation",
  "identifier": "edge-klubmotoristu-motoriste",
  "relationId": "edge-klubmotoristu-motoriste",
  "dossier": {
    "@id": "https://vomaste.cz/id/dossiers/macinka-turek"
  },
  "sourceEntity": {
    "@id": "https://vomaste.cz/id/entities/klubmotoristu"
  },
  "targetEntity": {
    "@id": "https://vomaste.cz/id/entities/motoriste"
  },
  "relationType": "DONATED_TO",
  "label": "dar 800 000 Kč (2024)",
  "status": "single",
  "claims": [
    {
      "@id": "https://vomaste.cz/id/dossiers/macinka-turek/claims/CLM-23"
    }
  ],
  "sources": [
    {
      "@id": "https://vomaste.cz/id/dossiers/macinka-turek/sources/SRC-26"
    }
  ],
  "subjects": [
    "macinka"
  ],
  "directed": true,
  "order": 15,
  "content": [
    {
      "type": "markdown",
      "value": "Tato stránka je kanonický záznam vztahu edge-klubmotoristu-motoriste — typ vztahu, podporující tvrzení a zdroje v tabulce výše jsou úplné. Status 1 ZDROJ znamená, že vztah stojí na jediném citovaném zdroji — stejně jako tvrzení, o které se opírá. Do 2026-07-30 tu byl uveden status FAKT („doloženo nezávisle potvrzenými zdroji\"), což bylo silnější, než zdroje unesou; vztahy tehdy neměly jednozdrojový stav k dispozici a jediná alternativa („kontextové\") by naopak tvrdila méně. Není to zjištění, že by vztah byl sporný — jen že ho zatím potvrzuje jedna redakce. Hlavní stránka dossieru vykresluje interaktivní graf ze stejných dat."
    }
  ]
}
